{
  "evidence_id": "ev-20260908-161957-3x16",
  "requirement_ids": [
    "DEBUG-01",
    "DEBUG-02",
    "DEBUG-03"
  ],
  "scenario_id": "S11",
  "category": "fixture",
  "status": "passed",
  "owner": "demo-runtime",
  "observed_at": "2026-09-08T16:19:57.444Z",
  "environment": "local",
  "code_revision": "ad989071d2eb4a5d1b66a37a6d5b3915ce32d2fa",
  "dirty_tree": true,
  "command": "demo-runtime runStep W13 attempt 1 source fixture",
  "exit_code": 0,
  "artifact_paths": [
    "evidence/artifacts/ev-20260908-161957-3x16/demo-events.json",
    "evidence/artifacts/ev-20260908-161957-3x16/request.json",
    "evidence/artifacts/ev-20260908-161957-3x16/response.json"
  ],
  "artifact_hashes": {
    "evidence/artifacts/ev-20260908-161957-3x16/demo-events.json": "6e34729c0e0b346a7757e437db11bbbc192b26afe652929a939679a7c4a1cba9",
    "evidence/artifacts/ev-20260908-161957-3x16/request.json": "71437584eb63dec3859e6bf4ab28d2d0876dcf3c260de2e906796ba690635c5f",
    "evidence/artifacts/ev-20260908-161957-3x16/response.json": "40e4be2c785ae5f2f54c22daf533c257e55936cb34e0a648a4b388c692d0fb11"
  },
  "redaction_review": {
    "removed_fields": [],
    "allowlist_version": "demo-runtime-1"
  },
  "limitations": "fixture observation; does not satisfy a sandbox, browser or human requirement",
  "notes": "demo run_id=run_41fe6c1289c0f45d correlation_id=step_d6cb9e263975fae9 step_id=W13 attempt=1 seq=93..101"
}