{
  "evidence_id": "ev-20260908-161957-jbtj",
  "requirement_ids": [
    "BUILD-09",
    "BUILD-10",
    "BUILD-11",
    "CODE-02",
    "SUBMIT-02"
  ],
  "scenario_id": "S05",
  "category": "fixture",
  "status": "passed",
  "owner": "demo-runtime",
  "observed_at": "2026-09-08T16:19:57.438Z",
  "environment": "local",
  "code_revision": "ad989071d2eb4a5d1b66a37a6d5b3915ce32d2fa",
  "dirty_tree": true,
  "command": "demo-runtime runStep W05 attempt 1 source fixture",
  "exit_code": 0,
  "artifact_paths": [
    "evidence/artifacts/ev-20260908-161957-jbtj/demo-events.json",
    "evidence/artifacts/ev-20260908-161957-jbtj/request.json",
    "evidence/artifacts/ev-20260908-161957-jbtj/response.json"
  ],
  "artifact_hashes": {
    "evidence/artifacts/ev-20260908-161957-jbtj/demo-events.json": "918d7ebd1cc1d2e2e2ab7fce2ea823f675544a25e9989c2d3fba24efb5731dfb",
    "evidence/artifacts/ev-20260908-161957-jbtj/request.json": "ccfcb8a34b08214b661a3ae401838b6aa1494dd478829018248ee76d92dd89b0",
    "evidence/artifacts/ev-20260908-161957-jbtj/response.json": "7efbbdd35b90252cecc3a62953c262114abaf03370919dcc44e6bae26a3d3a3c"
  },
  "redaction_review": {
    "removed_fields": [],
    "allowlist_version": "demo-runtime-1"
  },
  "limitations": "fixture observation; does not satisfy a sandbox, browser or human requirement",
  "notes": "demo run_id=run_41fe6c1289c0f45d correlation_id=step_b2cd81c9758814a6 step_id=W05 attempt=1 seq=29..41"
}